{
  "$schema": "../docs/class-data-schema.json",
  "name": "MPSI1",
  "firstGroup": 1,
  "groups": [
    {
      "students": [
        "ALQUIER Eliot",
        "BENEDETTO Noah",
        "BESANCON-MATHIL Damien"
      ],
      "program": [
        [1, 27],
        [5, 19],
        [11, 26],
        [12, 22],
        [8, 30],
        [7, 20],
        [10, 25],
        [0, 16],
        [4, 28],
        [],
        [15, 24],
        [3, 13, 18, 23],
        [9, 31],
        [2, 17],
        [14, 29],
        [6, 21],
        [1, 27],
        [5, 19],
        [11, 26],
        [12, 22],
        [8, 30],
        [7, 20],
        [10, 25],
        [0, 16],
        [4, 28],
        [],
        [15, 24],
        [3, 13, 18, 23],
        [9, 31],
        [2, 17]
      ]
    },
    {
      "students": [
        "BICHE Martin",
        "BOUTON Jérémy",
        "BRUCHON Clément"
      ],
      "program": [
        [6, 21],
        [1, 27],
        [5, 19],
        [11, 26],
        [12, 22],
        [8, 30],
        [7, 20],
        [10, 25],
        [0, 16],
        [4, 28],
        [],
        [15, 24],
        [3, 13, 18, 23],
        [9, 31],
        [2, 17],
        [14, 29],
        [6, 21],
        [1, 27],
        [5, 19],
        [11, 26],
        [12, 22],
        [8, 30],
        [7, 20],
        [10, 25],
        [0, 16],
        [4, 28],
        [],
        [15, 24],
        [3, 13, 18, 23],
        [9, 31]
      ]
    },
    {
      "students": [
        "BUCHET Julien",
        "BUNET Gabin",
        "DEBEAUX Juliette"
      ],
      "program": [
        [14, 29],
        [6, 21],
        [1, 27],
        [5, 19],
        [11, 26],
        [12, 22],
        [8, 30],
        [7, 20],
        [10, 25],
        [0, 16],
        [4, 28],
        [],
        [15, 24],
        [3, 13, 18, 23],
        [9, 31],
        [2, 17],
        [14, 29],
        [6, 21],
        [1, 27],
        [5, 19],
        [11, 26],
        [12, 22],
        [8, 30],
        [7, 20],
        [10, 25],
        [0, 16],
        [4, 28],
        [],
        [15, 24],
        [3, 13, 18, 23]
      ]
    },
    {
      "students": [
        "DELMAIRE-SIZES Antoine",
        "DOMAGE Alexis",
        "ESTIVAL Valentine"
      ],
      "program": [
        [2, 17],
        [14, 29],
        [6, 21],
        [1, 27],
        [5, 19],
        [11, 26],
        [12, 22],
        [8, 30],
        [7, 20],
        [10, 25],
        [0, 16],
        [4, 28],
        [],
        [15, 24],
        [3, 13, 18, 23],
        [9, 31],
        [2, 17],
        [14, 29],
        [6, 21],
        [1, 27],
        [5, 19],
        [11, 26],
        [12, 22],
        [8, 30],
        [7, 20],
        [10, 25],
        [0, 16],
        [4, 28],
        [],
        [15, 24]
      ]
    },
    {
      "students": [
        "FAVIER Elliot",
        "TOKAREK Lenny",
        "FOUCHET Gabriel"
      ],
      "program": [
        [9, 31],
        [2, 17],
        [14, 29],
        [6, 21],
        [1, 27],
        [5, 19],
        [11, 26],
        [12, 22],
        [8, 30],
        [7, 20],
        [10, 25],
        [0, 16],
        [4, 28],
        [],
        [15, 24],
        [3, 13, 18, 23],
        [9, 31],
        [2, 17],
        [14, 29],
        [6, 21],
        [1, 27],
        [5, 19],
        [11, 26],
        [12, 22],
        [8, 30],
        [7, 20],
        [10, 25],
        [0, 16],
        [4, 28],
        []
      ]
    },
    {
      "students": [
        "FONTBONNE Étienne",
        "FOULON Théodène",
        "GALICE Mahaut"
      ],
      "program": [
        [3, 13, 18, 23],
        [9, 31],
        [2, 17],
        [14, 29],
        [6, 21],
        [1, 27],
        [5, 19],
        [11, 26],
        [12, 22],
        [8, 30],
        [7, 20],
        [10, 25],
        [0, 16],
        [4, 28],
        [],
        [15, 24],
        [3, 13, 18, 23],
        [9, 31],
        [2, 17],
        [14, 29],
        [6, 21],
        [1, 27],
        [5, 19],
        [11, 26],
        [12, 22],
        [8, 30],
        [7, 20],
        [10, 25],
        [0, 16],
        [4, 28]
      ]
    },
    {
      "students": [
        "GAUTIER Simon",
        "GENIN Mathias",
        "LAMARD Gabin"
      ],
      "program": [
        [15, 24],
        [3, 13, 18, 23],
        [9, 31],
        [2, 17],
        [14, 29],
        [6, 21],
        [1, 27],
        [5, 19],
        [11, 26],
        [12, 22],
        [8, 30],
        [7, 20],
        [10, 25],
        [0, 16],
        [4, 28],
        [],
        [15, 24],
        [3, 13, 18, 23],
        [9, 31],
        [2, 17],
        [14, 29],
        [6, 21],
        [1, 27],
        [5, 19],
        [11, 26],
        [12, 22],
        [8, 30],
        [7, 20],
        [10, 25],
        [0, 16]
      ]
    },
    {
      "students": [
        "JAN Agathe",
        "JUCHORS Paul",
        "LEFEBVRE Tristan"
      ],
      "program": [
        [],
        [15, 24],
        [3, 13, 18, 23],
        [9, 31],
        [2, 17],
        [14, 29],
        [6, 21],
        [1, 27],
        [5, 19],
        [11, 26],
        [12, 22],
        [8, 30],
        [7, 20],
        [10, 25],
        [0, 16],
        [4, 28],
        [],
        [15, 24],
        [3, 13, 18, 23],
        [9, 31],
        [2, 17],
        [14, 29],
        [6, 21],
        [1, 27],
        [5, 19],
        [11, 26],
        [12, 22],
        [8, 30],
        [7, 20],
        [10, 25]
      ]
    },
    {
      "students": [
        "GRZESKOWIAK Romain",
        "KERMABON Elodie",
        "PEEREN Sarah"
      ],
      "program": [
        [4, 28],
        [],
        [15, 24],
        [3, 13, 18, 23],
        [9, 31],
        [2, 17],
        [14, 29],
        [6, 21],
        [1, 27],
        [5, 19],
        [11, 26],
        [12, 22],
        [8, 30],
        [7, 20],
        [10, 25],
        [0, 16],
        [4, 28],
        [],
        [15, 24],
        [3, 13, 18, 23],
        [9, 31],
        [2, 17],
        [14, 29],
        [6, 21],
        [1, 27],
        [5, 19],
        [11, 26],
        [12, 22],
        [8, 30],
        [7, 20]
      ]
    },
    {
      "students": [
        "LEFÈVRE Antide",
        "LEYOUDEC Pierre",
        "MALATY Paul"
      ],
      "program": [
        [0, 16],
        [4, 28],
        [],
        [15, 24],
        [3, 13, 18, 23],
        [9, 31],
        [2, 17],
        [14, 29],
        [6, 21],
        [1, 27],
        [5, 19],
        [11, 26],
        [12, 22],
        [8, 30],
        [7, 20],
        [10, 25],
        [0, 16],
        [4, 28],
        [],
        [15, 24],
        [3, 13, 18, 23],
        [9, 31],
        [2, 17],
        [14, 29],
        [6, 21],
        [1, 27],
        [5, 19],
        [11, 26],
        [12, 22],
        [8, 30]
      ]
    },
    {
      "students": [
        "MANIERE Lise",
        "MARVILLE Lucas",
        "MATTEI Alban"
      ],
      "program": [
        [10, 25],
        [0, 16],
        [4, 28],
        [],
        [15, 24],
        [3, 13, 18, 23],
        [9, 31],
        [2, 17],
        [14, 29],
        [6, 21],
        [1, 27],
        [5, 19],
        [11, 26],
        [12, 22],
        [8, 30],
        [7, 20],
        [10, 25],
        [0, 16],
        [4, 28],
        [],
        [15, 24],
        [3, 13, 18, 23],
        [9, 31],
        [2, 17],
        [14, 29],
        [6, 21],
        [1, 27],
        [5, 19],
        [11, 26],
        [12, 22]
      ]
    },
    {
      "students": [
        "MEYER Théodore",
        "OLIVIER Julien",
        "PAGNIER Leny"
      ],
      "program": [
        [7, 20],
        [10, 25],
        [0, 16],
        [4, 28],
        [],
        [15, 24],
        [3, 13, 18, 23],
        [9, 31],
        [2, 17],
        [14, 29],
        [6, 21],
        [1, 27],
        [5, 19],
        [11, 26],
        [12, 22],
        [8, 30],
        [7, 20],
        [10, 25],
        [0, 16],
        [4, 28],
        [],
        [15, 24],
        [3, 13, 18, 23],
        [9, 31],
        [2, 17],
        [14, 29],
        [6, 21],
        [1, 27],
        [5, 19],
        [11, 26]
      ]
    },
    {
      "students": [
        "PERRIN Inès",
        "PICHERY Léo",
        "SAHRAOUI Mohamed"
      ],
      "program": [
        [8, 30],
        [7, 20],
        [10, 25],
        [0, 16],
        [4, 28],
        [],
        [15, 24],
        [3, 13, 18, 23],
        [9, 31],
        [2, 17],
        [14, 29],
        [6, 21],
        [1, 27],
        [5, 19],
        [11, 26],
        [12, 22],
        [8, 30],
        [7, 20],
        [10, 25],
        [0, 16],
        [4, 28],
        [],
        [15, 24],
        [3, 13, 18, 23],
        [9, 31],
        [2, 17],
        [14, 29],
        [6, 21],
        [1, 27],
        [5, 19]
      ]
    },
    {
      "students": [
        "TAYEBI Adel",
        "SIERRA Maïténa",
        "VERNEVAUT Tom"
      ],
      "program": [
        [12, 22],
        [8, 30],
        [7, 20],
        [10, 25],
        [0, 16],
        [4, 28],
        [],
        [15, 24],
        [3, 13, 18, 23],
        [9, 31],
        [2, 17],
        [14, 29],
        [6, 21],
        [1, 27],
        [5, 19],
        [11, 26],
        [12, 22],
        [8, 30],
        [7, 20],
        [10, 25],
        [0, 16],
        [4, 28],
        [],
        [15, 24],
        [3, 13, 18, 23],
        [9, 31],
        [2, 17],
        [14, 29],
        [6, 21],
        [1, 27]
      ],
      "perStudentProgram": {
        "2": [
          { "week": 1, "index": null, "newColle": 32 },
          { "week": 3, "index": null, "newColle": 32 },
          { "week": 5, "index": null, "newColle": 32 },
          { "week": 7, "index": null, "newColle": 32 },
          { "week": 9, "index": null, "newColle": 32 },
          { "week": 11, "index": null, "newColle": 32 },
          { "week": 13, "index": null, "newColle": 32 },
          { "week": 15, "index": null, "newColle": 32 },